{
  "attempt_id": "specdriftbench-heldout432-20260718-af3db03-01",
  "cache_hit": false,
  "content_length": 0,
  "cost_cny_delta": 0.0,
  "error": {
    "actual_network_attempts": 1,
    "attempt_number": 1,
    "category": "PROVIDER_ERROR",
    "failure_layer": "UNKNOWN",
    "provider_error_code": null,
    "request_id": null,
    "retryable": false,
    "sanitized_message": "provider HTTP client error",
    "status_code": null
  },
  "error_class": "PROVIDER_ERROR",
  "evaluation": {
    "category_correct": null,
    "class_correct": null,
    "location_correct": null,
    "target_correct": null
  },
  "evidence_sha256": "e822235fff8588aa34c73749859ab2190854deefe5ce2547cf1b315428e87612",
  "evidence_view": "FULL_EVIDENCE",
  "execution_status": "REAL_PROVIDER",
  "experiment_mode": "SPECDRIFTBENCH_COMPONENT_HELDOUT_432",
  "fallback_used": false,
  "family": "M09",
  "finish_reason": null,
  "format_repairs": 0,
  "input_tokens": 0,
  "latency_ms": 0,
  "leakage": {
    "api_key_value_present": false,
    "hidden_fields": [],
    "passed": true
  },
  "main_state_pollution": false,
  "max_tokens": 1024,
  "model": "deepseek-v4-flash",
  "normalized_prediction": null,
  "output_tokens": 0,
  "paired_group_id": "pair-1018c42da59e0acc",
  "parsed_result": null,
  "provider": "deepseek",
  "provider_attempts": 1,
  "provider_profile_id": "deepseek-openai-compatible-v1",
  "public_scenario_id": "public-9c6340cc26ca",
  "raw_response_ref": null,
  "raw_response_sha256": null,
  "reasoning_tokens": 0,
  "record_id": "1f0bd7f850eec55163ac969a",
  "repetition": 1,
  "schema_valid": false,
  "schema_version": "specdriftbench-component-heldout-record-v1",
  "termination_reason": "PROVIDER_ERROR",
  "variant": "PD"
}
