{
  "attempt_id": "specdriftbench-heldout432-20260718-af3db03-01",
  "cache_hit": false,
  "content_length": 597,
  "cost_cny_delta": 0.008508149999999937,
  "error": null,
  "error_class": "NONE",
  "evaluation": {
    "category_correct": false,
    "class_correct": false,
    "location_correct": true,
    "target_correct": false
  },
  "evidence_sha256": "1b3b2af8bcae25bf636a002ab225b467fd19565c48afde20d32d4072fac72dfd",
  "evidence_view": "FULL_EVIDENCE",
  "execution_status": "REAL_PROVIDER",
  "experiment_mode": "SPECDRIFTBENCH_COMPONENT_HELDOUT_432",
  "fallback_used": false,
  "family": "M08",
  "finish_reason": "stop",
  "format_repairs": 0,
  "input_tokens": 7977,
  "latency_ms": 3088.6554999997315,
  "leakage": {
    "api_key_value_present": false,
    "hidden_fields": [],
    "passed": true
  },
  "main_state_pollution": false,
  "max_tokens": 1024,
  "model": "deepseek-v4-flash",
  "normalized_prediction": {
    "abstain": false,
    "concise_reason": "The spec requires 'role' and 'base_permission' at the top level of Member, but the runtime returns them nested under 'permissions' as 'role_name' and 'base'. This is a persistent response structure mismatch (RSD).",
    "confidence": 0.95,
    "drift_category": "RSD",
    "normalized_location": {
      "layer": "response",
      "runtime_path": "data.permissions.role_name, data.permissions.base",
      "spec_pointer": "/components/schemas/Member/required",
      "tool_id": "get_member"
    },
    "predicted_class": "PERSISTENT_DRIFT",
    "target_tool": "get_member"
  },
  "output_tokens": 174,
  "paired_group_id": "pair-ab04b8c7844f1566",
  "parsed_result": {
    "abstain": false,
    "concise_reason": "The spec requires 'role' and 'base_permission' at the top level of Member, but the runtime returns them nested under 'permissions' as 'role_name' and 'base'. This is a persistent response structure mismatch (RSD).",
    "confidence": 0.95,
    "drift_category": "RSD",
    "normalized_location": {
      "layer": "response",
      "runtime_path": "data.permissions.role_name, data.permissions.base",
      "spec_pointer": "/components/schemas/Member/required",
      "tool_id": "get_member"
    },
    "predicted_class": "PERSISTENT_DRIFT",
    "target_tool": "get_member"
  },
  "provider": "deepseek",
  "provider_attempts": 1,
  "provider_profile_id": "deepseek-openai-compatible-v1",
  "public_scenario_id": "public-4428482ce42e",
  "raw_response_ref": "deepseek/specdriftbench_component_heldout432_real_v1/raw/ceaa35fe5083c2f877ec65f133cd495bd6f217dbc1f6f0bd67f59e95848223b8.json",
  "raw_response_sha256": "ef079ae82f856b21cd83eb7171640383cd2133cb1670726e3ff24cfef108379f",
  "reasoning_tokens": 0,
  "record_id": "94a9d17dee1e1b74412116e9",
  "repetition": 1,
  "schema_valid": true,
  "schema_version": "specdriftbench-component-heldout-record-v1",
  "termination_reason": "COMPONENT_COMPLETE",
  "variant": "AE"
}
